[
  {
    "id": "d-xy8-1",
    "name": "Burning Spark",
    "types": [
      "Lightning",
      "Fire"
    ],
    "cards": [
      {
        "id": "xy8-49",
        "name": "Raichu",
        "rarity": "Rare Holo",
        "count": 1
      },
      {
        "id": "xy8-49",
        "name": "Raichu",
        "rarity": "Rare",
        "count": 1
      },
      {
        "id": "xy8-48",
        "name": "Pikachu",
        "rarity": "Common",
        "count": 3
      },
      {
        "id": "xy8-54",
        "name": "Magnezone",
        "rarity": "Rare",
        "count": 1
      },
      {
        "id": "xy8-53",
        "name": "Magneton",
        "rarity": "Uncommon",
        "count": 2
      },
      {
        "id": "xy8-52",
        "name": "Magnemite",
        "rarity": "Common",
        "count": 3
      },
      {
        "id": "xy8-57",
        "name": "Dedenne",
        "rarity": "Uncommon",
        "count": 2
      },
      {
        "id": "xy8-56",
        "name": "Stunfisk",
        "rarity": "Uncommon",
        "count": 2
      },
      {
        "id": "xy8-26",
        "name": "Braixen",
        "rarity": "Uncommon",
        "count": 2
      },
      {
        "id": "xy8-25",
        "name": "Fennekin",
        "rarity": "Common",
        "count": 3
      },
      {
        "id": "xy8-19",
        "name": "Quilava",
        "rarity": "Uncommon",
        "count": 2
      },
      {
        "id": "xy8-18",
        "name": "Cyndaquil",
        "rarity": "Common",
        "count": 2
      },
      {
        "id": "xy8-23",
        "name": "Pansear",
        "rarity": "Common",
        "count": 2
      },
      {
        "id": "xy8-117",
        "name": "Dodrio",
        "rarity": "Rare",
        "count": 1
      },
      {
        "id": "xy8-116",
        "name": "Doduo",
        "rarity": "Common",
        "count": 2
      },
      {
        "id": "xy8-123",
        "name": "Smeargle",
        "rarity": "Rare",
        "count": 1
      },
      {
        "id": "xy8-136",
        "name": "Fisherman",
        "rarity": "Uncommon",
        "count": 1
      },
      {
        "id": "xy8-138",
        "name": "Giovanni's Scheme",
        "rarity": "Uncommon",
        "count": 1
      },
      {
        "id": "xy2-93",
        "name": "Pokémon Center Lady",
        "rarity": "Uncommon",
        "count": 1
      },
      {
        "id": "xy2-94",
        "name": "Pokémon Fan Club",
        "rarity": "Uncommon",
        "count": 1
      },
      {
        "id": "xy8-146",
        "name": "Professor's Letter",
        "rarity": "Uncommon",
        "count": 2
      },
      {
        "id": "xy8-147",
        "name": "Reserved Ticket",
        "rarity": "Uncommon",
        "count": 1
      },
      {
        "id": "xy8-149",
        "name": "Super Rod",
        "rarity": "Uncommon",
        "count": 1
      },
      {
        "id": "xy8-148",
        "name": "Skyla",
        "rarity": "Uncommon",
        "count": 1
      },
      {
        "id": "xy0-38",
        "name": "Switch",
        "count": 1
      },
      {
        "id": "xy4-107",
        "name": "Tierno",
        "rarity": "Uncommon",
        "count": 1
      },
      {
        "id": "xy6-94",
        "name": "Wally",
        "rarity": "Uncommon",
        "count": 1
      },
      {
        "id": "xy1-135",
        "name": "Lightning Energy",
        "count": 10
      },
      {
        "id": "xy1-133",
        "name": "Fire Energy",
        "count": 8
      }
    ]
  },
  {
    "id": "d-xy8-2",
    "name": "Night Striker",
    "types": [
      "Psychic",
      "Darkness"
    ],
    "cards": [
      {
        "id": "xy8-112",
        "name": "Noivern",
        "rarity": "Rare Holo",
        "count": 1
      },
      {
        "id": "xy8-112",
        "name": "Noivern",
        "rarity": "Rare",
        "count": 1
      },
      {
        "id": "xy8-131",
        "name": "Noibat",
        "rarity": "Common",
        "count": 4
      },
      {
        "id": "xy8-60",
        "name": "Gengar",
        "rarity": "Rare",
        "count": 1
      },
      {
        "id": "xy8-59",
        "name": "Haunter",
        "rarity": "Uncommon",
        "count": 2
      },
      {
        "id": "xy8-58",
        "name": "Gastly",
        "rarity": "Common",
        "count": 3
      },
      {
        "id": "xy8-69",
        "name": "Kirlia",
        "rarity": "Uncommon",
        "count": 2
      },
      {
        "id": "xy8-68",
        "name": "Ralts",
        "rarity": "Common",
        "count": 2
      },
      {
        "id": "xy8-70",
        "name": "Cresselia",
        "rarity": "Rare",
        "count": 1
      },
      {
        "id": "xy8-65",
        "name": "Misdreavus",
        "rarity": "Common",
        "count": 2
      },
      {
        "id": "xy8-67",
        "name": "Wobbuffet",
        "rarity": "Uncommon",
        "count": 2
      },
      {
        "id": "xy8-91",
        "name": "Zoroark",
        "rarity": "Rare",
        "count": 1
      },
      {
        "id": "xy8-90",
        "name": "Zorua",
        "rarity": "Common",
        "count": 2
      },
      {
        "id": "xy8-93",
        "name": "Inkay",
        "rarity": "Common",
        "count": 2
      },
      {
        "id": "xy8-122",
        "name": "Ursaring",
        "rarity": "Uncommon",
        "count": 2
      },
      {
        "id": "xy8-121",
        "name": "Teddiursa",
        "rarity": "Common",
        "count": 2
      },
      {
        "id": "xy8-136",
        "name": "Fisherman",
        "rarity": "Uncommon",
        "count": 1
      },
      {
        "id": "xy8-138",
        "name": "Giovanni's Scheme",
        "rarity": "Uncommon",
        "count": 1
      },
      {
        "id": "xy2-93",
        "name": "Pokémon Center Lady",
        "rarity": "Uncommon",
        "count": 1
      },
      {
        "id": "xy2-94",
        "name": "Pokémon Fan Club",
        "rarity": "Uncommon",
        "count": 1
      },
      {
        "id": "xy8-146",
        "name": "Professor's Letter",
        "rarity": "Uncommon",
        "count": 2
      },
      {
        "id": "xy8-147",
        "name": "Reserved Ticket",
        "rarity": "Uncommon",
        "count": 1
      },
      {
        "id": "xy8-148",
        "name": "Skyla",
        "rarity": "Uncommon",
        "count": 1
      },
      {
        "id": "xy0-38",
        "name": "Switch",
        "count": 1
      },
      {
        "id": "xy4-107",
        "name": "Tierno",
        "rarity": "Uncommon",
        "count": 2
      },
      {
        "id": "xy6-94",
        "name": "Wally",
        "rarity": "Uncommon",
        "count": 1
      },
      {
        "id": "xy1-136",
        "name": "Psychic Energy",
        "count": 11
      },
      {
        "id": "xy1-138",
        "name": "Darkness Energy",
        "count": 7
      }
    ]
  }
]