[
  {
    "id": "d-swsh3-1",
    "name": "Galarian Darmanitan",
    "types": [
      "Water"
    ],
    "cards": [
      {
        "id": "swsh3-44",
        "name": "Galarian Darmanitan",
        "rarity": "Rare Holo",
        "count": 1
      },
      {
        "id": "swsh3-44",
        "name": "Galarian Darmanitan",
        "rarity": "Rare",
        "count": 1
      },
      {
        "id": "swsh3-28",
        "name": "Galarian Darmanitan",
        "rarity": "Rare",
        "count": 1
      },
      {
        "id": "swsh3-43",
        "name": "Galarian Darumaka",
        "rarity": "Common",
        "count": 3
      },
      {
        "id": "swsh2-42",
        "name": "Pelipper",
        "rarity": "Uncommon",
        "count": 2
      },
      {
        "id": "swsh2-44",
        "name": "Wingull",
        "rarity": "Common",
        "count": 3
      },
      {
        "id": "swsh3-49",
        "name": "Beartic",
        "rarity": "Rare",
        "count": 2
      },
      {
        "id": "swsh3-48",
        "name": "Cubchoo",
        "rarity": "Common",
        "count": 3
      },
      {
        "id": "swsh3-50",
        "name": "Wishiwashi",
        "rarity": "Common",
        "count": 2
      },
      {
        "id": "swsh3-37",
        "name": "Suicune",
        "rarity": "Rare",
        "count": 2
      },
      {
        "id": "swsh3-133",
        "name": "Kangaskhan",
        "rarity": "Uncommon",
        "count": 2
      },
      {
        "id": "swsh1-157",
        "name": "Bede",
        "rarity": "Uncommon",
        "count": 2
      },
      {
        "id": "swsh3-159",
        "name": "Bird Keeper",
        "rarity": "Uncommon",
        "count": 2
      },
      {
        "id": "swsh2-156",
        "name": "Capacious Bucket",
        "rarity": "Uncommon",
        "count": 2
      },
      {
        "id": "swsh1-164",
        "name": "Great Ball",
        "rarity": "Uncommon",
        "count": 2
      },
      {
        "id": "swsh1-165",
        "name": "Hop",
        "rarity": "Uncommon",
        "count": 4
      },
      {
        "id": "swsh1-178",
        "name": "Professor's Research",
        "rarity": "Rare",
        "count": 2
      },
      {
        "id": "swsh2-167",
        "name": "Sonia",
        "rarity": "Uncommon",
        "count": 2
      },
      {
        "id": "swsh1-183",
        "name": "Switch",
        "rarity": "Uncommon",
        "count": 2
      },
      {
        "id": "swsh3-172",
        "name": "Turbo Patch",
        "rarity": "Uncommon",
        "count": 2
      },
      {
        "id": "swsh1-0",
        "name": "Water Energy",
        "count": 18
      }
    ]
  },
  {
    "id": "d-swsh3-2",
    "name": "Galarian Sirfetch'd",
    "types": [
      "Fighting"
    ],
    "cards": [
      {
        "id": "swsh3-98",
        "name": "Galarian Sirfetch'd",
        "rarity": "Rare Holo",
        "count": 1
      },
      {
        "id": "swsh3-98",
        "name": "Galarian Sirfetch'd",
        "rarity": "Rare",
        "count": 2
      },
      {
        "id": "swsh2-94",
        "name": "Galarian Farfetch'd",
        "rarity": "Common",
        "count": 3
      },
      {
        "id": "swsh3-85",
        "name": "Dugtrio",
        "rarity": "Uncommon",
        "count": 2
      },
      {
        "id": "swsh3-84",
        "name": "Diglett",
        "rarity": "Common",
        "count": 3
      },
      {
        "id": "swsh3-94",
        "name": "Hippowdon",
        "rarity": "Rare",
        "count": 2
      },
      {
        "id": "swsh3-93",
        "name": "Hippopotas",
        "rarity": "Common",
        "count": 3
      },
      {
        "id": "swsh2-111",
        "name": "Stonjourner",
        "rarity": "Rare",
        "count": 2
      },
      {
        "id": "swsh1-100",
        "name": "Sudowoodo",
        "rarity": "Uncommon",
        "count": 2
      },
      {
        "id": "swsh3-97",
        "name": "Passimian",
        "rarity": "Common",
        "count": 2
      },
      {
        "id": "swsh1-157",
        "name": "Bede",
        "rarity": "Uncommon",
        "count": 2
      },
      {
        "id": "swsh3-159",
        "name": "Bird Keeper",
        "rarity": "Uncommon",
        "count": 2
      },
      {
        "id": "swsh1-164",
        "name": "Great Ball",
        "rarity": "Uncommon",
        "count": 2
      },
      {
        "id": "swsh1-165",
        "name": "Hop",
        "rarity": "Uncommon",
        "count": 4
      },
      {
        "id": "swsh1-175",
        "name": "Pok√©mon Catcher",
        "rarity": "Uncommon",
        "count": 2
      },
      {
        "id": "swsh1-178",
        "name": "Professor's Research",
        "rarity": "Rare",
        "count": 2
      },
      {
        "id": "swsh2-167",
        "name": "Sonia",
        "rarity": "Uncommon",
        "count": 2
      },
      {
        "id": "swsh1-183",
        "name": "Switch",
        "rarity": "Uncommon",
        "count": 2
      },
      {
        "id": "swsh3-172",
        "name": "Turbo Patch",
        "rarity": "Uncommon",
        "count": 2
      },
      {
        "id": "swsh1-0",
        "name": "Fighting Energy",
        "count": 18
      }
    ]
  }
]